Title,Overview,Release Year,Runtime(Mins),Average Vote,Popularity,Genres,Cast,Director
Avatar,"In the 22nd century, a paraplegic Marine is dispatched to the moon Pandora on a unique mission, but becomes torn between following orders and protecting an alien civilization.",2009,162,7.578,103.956,Action,"Sam Worthington, Zoe Saldaña, Sigourney Weaver, Stephen Lang, Michelle Rodriguez",James Cameron
Pirates of the Caribbean: At World's End,"Captain Barbossa, long believed to be dead, has come back to life and is headed to the edge of the Earth with Will Turner and Elizabeth Swann. But nothing is quite as it seems.",2007,169,7.248,107.986,Adventure,"Johnny Depp, Orlando Bloom, Keira Knightley, Geoffrey Rush, Stellan Skarsgård",Gore Verbinski
Spectre,"A cryptic message from Bond’s past sends him on a trail to uncover a sinister organization. While M battles political forces to keep the secret service alive, Bond peels back the layers of deceit to reveal the terrible truth behind SPECTRE.",2015,148,6.539,46.54,Action,"Daniel Craig, Christoph Waltz, Léa Seydoux, Ralph Fiennes, Monica Bellucci",Sam Mendes
The Dark Knight Rises,"Following the death of District Attorney Harvey Dent, Batman assumes responsibility for Dent's crimes to protect the late attorney's reputation and is subsequently hunted by the Gotham City Police Department. Eight years later, Batman encounters the mysterious Selina Kyle and the villainous Bane, a new terrorist leader who overwhelms Gotham's finest. The Dark Knight resurfaces to protect a city that has branded him an enemy.",2012,165,7.778,63.878,Action,"Christian Bale, Michael Caine, Gary Oldman, Anne Hathaway, Tom Hardy",Christopher Nolan
John Carter,"John Carter is a war-weary, former military captain who's inexplicably transported to the mysterious and exotic planet of Barsoom (Mars) and reluctantly becomes embroiled in an epic conflict. It's a world on the brink of collapse, and Carter rediscovers his humanity when he realizes the survival of Barsoom and its people rests in his hands.",2012,132,6.31,40.481,Action,"Taylor Kitsch, Lynn Collins, Samantha Morton, Mark Strong, Ciarán Hinds",Andrew Stanton
Spider-Man 3,"The seemingly invincible Spider-Man goes up against an all-new crop of villains—including the shape-shifting Sandman. While Spider-Man’s superpowers are altered by an alien organism, his alter ego, Peter Parker, deals with nemesis Eddie Brock and also gets caught up in a love triangle.",2007,139,6.409,82.156,Action,"Tobey Maguire, Kirsten Dunst, James Franco, Thomas Haden Church, Topher Grace",Sam Raimi
Tangled,"When the kingdom's most wanted-and most charming-bandit Flynn Rider hides out in a mysterious tower, he's taken hostage by Rapunzel, a beautiful and feisty tower-bound teen with 70 feet of magical, golden hair. Flynn's curious captor, who's looking for her ticket out of the tower where she's been locked away for years, strikes a deal with the handsome thief and the unlikely duo sets off on an action-packed escapade, complete with a super-cop horse, an over-protective chameleon and a gruff gang of pub thugs.",2010,100,7.604,109.702,Animation,"Mandy Moore, Zachary Levi, Donna Murphy, Ron Perlman, Brad Garrett",Byron Howard
Avengers: Age of Ultron,"When Tony Stark tries to jumpstart a dormant peacekeeping program, things go awry and Earth’s Mightiest Heroes are put to the ultimate test as the fate of the planet hangs in the balance. As the villainous Ultron emerges, it is up to The Avengers to stop him from enacting his terrible plans, and soon uneasy alliances and unexpected action pave the way for an epic and unique global adventure.",2015,141,7.273,89.854,Action,"Robert Downey Jr., Chris Hemsworth, Mark Ruffalo, Chris Evans, Scarlett Johansson",Joss Whedon
Harry Potter and the Half-Blood Prince,"As Lord Voldemort tightens his grip on both the Muggle and wizarding worlds, Hogwarts is no longer a safe haven. Harry suspects perils may even lie within the castle, but Dumbledore is more intent upon preparing him for the final battle fast approaching. Together they work to find the key to unlock Voldemorts defenses and to this end, Dumbledore recruits his old friend and colleague Horace Slughorn, whom he believes holds crucial information. Even as the decisive showdown looms, romance blossoms for Harry, Ron, Hermione and their classmates. Love is in the air, but danger lies ahead and Hogwarts may never be the same again.",2009,153,7.7,136.029,Adventure,"Daniel Radcliffe, Rupert Grint, Emma Watson, Jim Broadbent, Michael Gambon",David Yates
Batman v Superman: Dawn of Justice,"Fearing the actions of a god-like Super Hero left unchecked, Gotham City’s own formidable, forceful vigilante takes on Metropolis’s most revered, modern-day savior, while the world wrestles with what sort of hero it really needs. And with Batman and Superman at war with one another, a new threat quickly arises, putting mankind in greater danger than it’s ever known before.",2016,152,5.962,73.81,Action,"Ben Affleck, Henry Cavill, Jesse Eisenberg, Gal Gadot, Amy Adams",Zack Snyder
Superman Returns,"Superman returns to discover his 5-year absence has allowed Lex Luthor to walk free, and that those he was closest to felt abandoned and have moved on. Luthor plots his ultimate revenge that could see millions killed and change the face of the planet forever, as well as ridding himself of the Man of Steel.",2006,154,5.749,33.599,Science Fiction,"Brandon Routh, Kevin Spacey, Kate Bosworth, James Marsden, Parker Posey",Bryan Singer
Quantum of Solace,"Betrayed by Vesper, the woman he loved, 007 fights the urge to make his latest mission personal. Pursuing his determination to uncover the truth, Bond and M interrogate Mr. White, who reveals that the organization that blackmailed Vesper is far more complex and dangerous than anyone had imagined.",2008,106,6.321,32.917,Adventure,"Daniel Craig, Olga Kurylenko, Mathieu Amalric, Judi Dench, Giancarlo Giannini",Marc Forster
Pirates of the Caribbean: Dead Man's Chest,Captain Jack Sparrow works his way out of a blood debt with the ghostly Davy Jones to avoid eternal damnation.,2006,151,7.35,104.589,Adventure,"Johnny Depp, Orlando Bloom, Keira Knightley, Stellan Skarsgård, Bill Nighy",Gore Verbinski
The Lone Ranger,"The Texas Rangers chase down a gang of outlaws led by Butch Cavendish, but the gang ambushes the Rangers, seemingly killing them all. One survivor is found, however, by an American Indian named Tonto, who nurses him back to health. The Ranger, donning a mask and riding a white stallion named Silver, teams up with Tonto to bring the unscrupulous gang and others of that ilk to justice.",2013,149,6.089,29.364,Action,"Johnny Depp, Armie Hammer, Tom Wilkinson, William Fichtner, Helena Bonham Carter",Gore Verbinski
Man of Steel,"A young boy learns that he has extraordinary powers and is not of this earth. As a young man, he journeys to discover where he came from and what he was sent here to do. But the hero in him must emerge if he is to save the world from annihilation and become the symbol of hope for all mankind.",2013,143,6.619,54.852,Action,"Henry Cavill, Amy Adams, Michael Shannon, Diane Lane, Russell Crowe",Zack Snyder
The Chronicles of Narnia: Prince Caspian,"One year after their incredible adventures in the Lion, the Witch and the Wardrobe, Peter, Edmund, Lucy and Susan Pevensie return to Narnia to aid a young prince whose life has been threatened by the evil King Miraz. Now, with the help of a colorful cast of new characters, including Trufflehunter the badger and Nikabrik the dwarf, the Pevensie clan embarks on an incredible quest to ensure that Narnia is returned to its rightful heir.",2008,150,6.62,45.214,Adventure,"Ben Barnes, Georgie Henley, Skandar Keynes, William Moseley, Anna Popplewell",Andrew Adamson
The Avengers,"When an unexpected enemy emerges and threatens global safety and security, Nick Fury, director of the international peacekeeping agency known as S.H.I.E.L.D., finds himself in need of a team to pull the world back from the brink of disaster. Spanning the globe, a daring recruitment effort begins!",2012,143,7.7,110.942,Science Fiction,"Robert Downey Jr., Chris Evans, Mark Ruffalo, Chris Hemsworth, Scarlett Johansson",Joss Whedon
Pirates of the Caribbean: On Stranger Tides,"Captain Jack Sparrow crosses paths with a woman from his past, and he's not sure if it's love -- or if she's a ruthless con artist who's using him to find the fabled Fountain of Youth. When she forces him aboard the Queen Anne's Revenge, the ship of the formidable pirate Blackbeard, Jack finds himself on an unexpected adventure in which he doesn't know who to fear more: Blackbeard or the woman from his past.",2011,137,6.543,107.356,Adventure,"Johnny Depp, Penélope Cruz, Geoffrey Rush, Ian McShane, Kevin McNally",Rob Marshall
Men in Black 3,"Agents J and K are back...in time. J has seen some inexplicable things in his 15 years with the Men in Black, but nothing, not even aliens, perplexes him as much as his wry, reticent partner. But when K's life and the fate of the planet are put at stake, Agent J will have to travel back in time to put things right. J discovers that there are secrets to the universe that K never told him - secrets that will reveal themselves as he teams up with the young Agent K to save his partner, the agency, and the future of humankind.",2012,106,6.5,48.908,Action,"Will Smith, Tommy Lee Jones, Josh Brolin, Jemaine Clement, Emma Thompson",Barry Sonnenfeld
The Hobbit: The Battle of the Five Armies,"Immediately after the events of The Desolation of Smaug, Bilbo and the dwarves try to defend Erebor's mountain of treasure from others who claim it: the men of the ruined Laketown and the elves of Mirkwood. Meanwhile an army of Orcs led by Azog the Defiler is marching on Erebor, fueled by the rise of the dark lord Sauron. Dwarves, elves and men must unite, and the hope for Middle-Earth falls into Bilbo's hands.",2014,144,7.314,152.52,Action,"Martin Freeman, Ian McKellen, Richard Armitage, Luke Evans, Orlando Bloom",Peter Jackson
